{
  "$id": "urn:wotex:profiles:schema:binding:1",
  "$schema": "http://json-schema.org/draft-07/schema#",
  "additionalProperties": false,
  "definitions": {
    "data_schema": {
      "additionalProperties": false,
      "properties": {
        "additionalProperties": {
          "const": false
        },
        "const": {},
        "description": {
          "type": "string"
        },
        "enum": {
          "maxItems": 256,
          "minItems": 1,
          "type": "array",
          "uniqueItems": true
        },
        "exclusiveMaximum": {
          "type": "number"
        },
        "exclusiveMinimum": {
          "type": "number"
        },
        "items": {
          "$ref": "#/definitions/data_schema"
        },
        "maxItems": {
          "minimum": 0,
          "type": "integer"
        },
        "maxLength": {
          "minimum": 0,
          "type": "integer"
        },
        "maximum": {
          "type": "number"
        },
        "minItems": {
          "minimum": 0,
          "type": "integer"
        },
        "minLength": {
          "minimum": 0,
          "type": "integer"
        },
        "minimum": {
          "type": "number"
        },
        "multipleOf": {
          "type": "number"
        },
        "observable": {
          "type": "boolean"
        },
        "properties": {
          "additionalProperties": {
            "$ref": "#/definitions/data_schema"
          },
          "type": "object"
        },
        "readOnly": {
          "type": "boolean"
        },
        "required": {
          "items": {
            "maxLength": 128,
            "minLength": 1,
            "type": "string"
          },
          "type": "array",
          "uniqueItems": true
        },
        "title": {
          "type": "string"
        },
        "type": {
          "enum": [
            "null",
            "boolean",
            "integer",
            "number",
            "string",
            "array",
            "object"
          ]
        },
        "writeOnly": {
          "type": "boolean"
        }
      },
      "required": [
        "type"
      ],
      "type": "object"
    },
    "reference": {
      "additionalProperties": false,
      "properties": {
        "id": {
          "maxLength": 256,
          "minLength": 1,
          "type": "string"
        },
        "sha256": {
          "pattern": "^[0-9a-f]{64}$",
          "type": "string"
        },
        "version": {
          "pattern": "^(0|[1-9][0-9]*)\\.(0|[1-9][0-9]*)\\.(0|[1-9][0-9]*)$",
          "type": "string"
        }
      },
      "required": [
        "id",
        "version",
        "sha256"
      ],
      "type": "object"
    },
    "scalar": {
      "oneOf": [
        {
          "additionalProperties": false,
          "properties": {
            "type": {
              "const": "null"
            }
          },
          "required": [
            "type"
          ],
          "type": "object"
        },
        {
          "additionalProperties": false,
          "properties": {
            "type": {
              "const": "boolean"
            },
            "value": {
              "type": "boolean"
            }
          },
          "required": [
            "type",
            "value"
          ],
          "type": "object"
        },
        {
          "additionalProperties": false,
          "properties": {
            "type": {
              "const": "text"
            },
            "value": {
              "maxLength": 4096,
              "type": "string"
            }
          },
          "required": [
            "type",
            "value"
          ],
          "type": "object"
        },
        {
          "additionalProperties": false,
          "properties": {
            "type": {
              "enum": [
                "sint",
                "uint"
              ]
            },
            "value": {
              "pattern": "^(0|-?[1-9][0-9]*)$",
              "type": "string"
            }
          },
          "required": [
            "type",
            "value"
          ],
          "type": "object"
        },
        {
          "additionalProperties": false,
          "properties": {
            "coefficient": {
              "pattern": "^(0|-?[1-9][0-9]*)$",
              "type": "string"
            },
            "exponent": {
              "maximum": 32767,
              "minimum": -32768,
              "type": "integer"
            },
            "type": {
              "const": "decimal"
            }
          },
          "required": [
            "type",
            "coefficient",
            "exponent"
          ],
          "type": "object"
        }
      ]
    },
    "unit": {
      "additionalProperties": false,
      "properties": {
        "dimension": {
          "items": {
            "maximum": 32,
            "minimum": -32,
            "type": "integer"
          },
          "maxItems": 7,
          "minItems": 7,
          "type": "array"
        },
        "offset_d": {
          "pattern": "^[1-9][0-9]*$",
          "type": "string"
        },
        "offset_n": {
          "pattern": "^(0|-?[1-9][0-9]*)$",
          "type": "string"
        },
        "quantity_kind": {
          "maxLength": 256,
          "minLength": 1,
          "type": "string"
        },
        "scale_d": {
          "pattern": "^[1-9][0-9]*$",
          "type": "string"
        },
        "scale_n": {
          "pattern": "^[1-9][0-9]*$",
          "type": "string"
        }
      },
      "required": [
        "quantity_kind",
        "dimension",
        "scale_n",
        "scale_d",
        "offset_n",
        "offset_d"
      ],
      "type": "object"
    }
  },
  "properties": {
    "capture_fields": {
      "items": {
        "pattern": "^[a-zA-Z0-9._-]{1,128}$",
        "type": "string"
      },
      "maxItems": 64,
      "type": "array",
      "uniqueItems": true
    },
    "codec_contracts": {
      "items": {
        "$ref": "#/definitions/reference"
      },
      "maxItems": 1024,
      "type": "array",
      "uniqueItems": true
    },
    "id": {
      "maxLength": 256,
      "minLength": 1,
      "type": "string"
    },
    "operations": {
      "items": {
        "enum": [
          "readproperty",
          "writeproperty",
          "observeproperty",
          "unobserveproperty",
          "invokeaction",
          "queryaction",
          "cancelaction",
          "subscribeevent",
          "unsubscribeevent"
        ]
      },
      "maxItems": 9,
      "minItems": 1,
      "type": "array",
      "uniqueItems": true
    },
    "raw_value_contract": {
      "$ref": "#/definitions/reference"
    },
    "raw_value_schema": {
      "$ref": "#/definitions/data_schema"
    },
    "selector_schema": {
      "$ref": "#/definitions/data_schema"
    },
    "sha256": {
      "pattern": "^[0-9a-f]{64}$",
      "type": "string"
    },
    "version": {
      "pattern": "^(0|[1-9][0-9]*)\\.(0|[1-9][0-9]*)\\.(0|[1-9][0-9]*)$",
      "type": "string"
    }
  },
  "required": [
    "id",
    "version",
    "sha256",
    "selector_schema",
    "operations",
    "capture_fields",
    "raw_value_contract",
    "raw_value_schema",
    "codec_contracts"
  ],
  "type": "object"
}
